{
  "schemaVersion": "1.0",
  "campaignId": "CHC-20260907",
  "createdAt": "2026-09-07T00:00:00.000Z",
  "baseline": {
    "commitSha": "aaaaaaaaaaaaaaaaaaaaaaaaaaaaaaaaaaaaaaaa",
    "treeSha": "bbbbbbbbbbbbbbbbbbbbbbbbbbbbbbbbbbbbbbbb",
    "sourceBundleSha256": "cccccccccccccccccccccccccccccccccccccccccccccccccccccccccccccccc",
    "analyzedAt": "2026-09-07T00:00:00.000Z"
  },
  "environmentMatrix": [
    {
      "platform": "win32",
      "shell": "git-bash",
      "runtime": "node20",
      "supported": true,
      "observed": "observed",
      "reason": "controlled environment observed"
    }
  ],
  "candidateIds": ["CHG-P1-20260907-001"],
  "ledgerPath": ".w-model/code-health/ledger.jsonl",
  "evidencePath": ".w-model/code-health/evidence.jsonl",
  "approvalPath": ".w-model/code-health/approvals.jsonl",
  "archivePath": ".w-model/code-health/archive.jsonl",
  "appendOnly": true,
  "redaction": {
    "status": "clean",
    "rules": ["remove secrets", "retain repository-relative paths"],
    "blockedReasons": []
  }
}
